<?xml version="1.0"?>
<!DOCTYPE Report
[
<!ELEMENT Report (General ,(Doc|BPT)) >
<!ATTLIST Report ver CDATA #REQUIRED tmZone CDATA #REQUIRED>

<!ELEMENT General ( DocLocation ) >
<!ATTLIST General productName CDATA #REQUIRED productVer CDATA #REQUIRED os CDATA #REQUIRED host CDATA #REQUIRED qcserver CDATA #IMPLIED qcproject CDATA #IMPLIED SolManSolutionId CDATA #IMPLIED SolManProjectId CDATA #IMPLIED SolManTestPlanId CDATA #IMPLIED SolManTestPackageId CDATA #IMPLIED SolManUserInfoData CDATA #IMPLIED  >

<!ELEMENT BPT (DName,Res,DVer?,TSet?,TInst?,NodeArgs,AdditionalInfo*,Doc*) >
<!ATTLIST BPT rID ID #REQUIRED >

<!ELEMENT Doc (DName,ConfName?,Res,DVer?,TSet?,TInst?,RunType?,DT?,AdditionalInfo*,Step*,DIter*,Step*,Action*,Doc*,Summary?,TestMaintenanceSummary*,NodeArgs?) >
<!ATTLIST Doc rID ID #REQUIRED type (Test|BC|BPTWrapperTest|Flow|Group|Action) "Test" productName CDATA #REQUIRED BCIter CDATA #IMPLIED >

<!ELEMENT RunType ( #PCDATA )>
<!ATTLIST RunType fmStep (False|True) "False" batch (False|True) "False" upDesc (False|True) "False" upChk (False|True) "False" upAS (False|True) "False">

<!ELEMENT DName ( #PCDATA ) >

<!ELEMENT ConfName ( #PCDATA ) >

<!ELEMENT Res ( #PCDATA ) >

<!ELEMENT AdditionalInfo (AdditionalDataName,AdditionalDataValue ) >

<!ELEMENT AdditionalDataName ( #PCDATA ) >

<!ELEMENT AdditionalDataValue ( #PCDATA ) >

<!ELEMENT DVer ( #PCDATA ) >

<!ELEMENT TSet ( #PCDATA ) >

<!ELEMENT TInst ( #PCDATA ) >

<!ELEMENT DIter (Step*,Action+,Summary?,NodeArgs)>
<!ATTLIST DIter rID ID #REQUIRED iterID CDATA #REQUIRED>

<!ELEMENT DocLocation ( #PCDATA )>

<!ELEMENT Action (AName,AIter*,(Step|HtmlStep|Action)*, Summary,ActionMaintenanceSummary*, NodeArgs ) >
<!ATTLIST Action rID ID #REQUIRED>

<!ELEMENT AIter ((Step|HtmlStep|Action)*,DataMapping?, Summary?,NodeArgs) >
<!ATTLIST AIter rID ID #REQUIRED iterID CDATA #REQUIRED isCountable (False|True) "False" >

<!ELEMENT AName ( #PCDATA ) >

<!ELEMENT TestMaintenanceSummary (ActionMaintenanceSummary*) >
<!ATTLIST TestMaintenanceSummary ObjectsAdded CDATA #REQUIRED ObjectsUpdated CDATA #REQUIRED StepsUpdated CDATA #REQUIRED StepsComments CDATA #REQUIRED><!ELEMENT ActionMaintenanceSummary (ObjectChange* ) >
<!ATTLIST ActionMaintenanceSummary Action CDATA #REQUIRED Objects CDATA #REQUIRED Updated CDATA #REQUIRED LinesTotal CDATA #REQUIRED Added CDATA #REQUIRED LinesUpdated CDATA #REQUIRED>

<!ELEMENT ObjectChange  (Hierarchy, PropertyChangeList* ) >
<!ATTLIST ObjectChange Operation CDATA #IMPLIED OriginalRepository CDATA #IMPLIED>

<!ELEMENT PropertyChangeList (PropertyDef*) >

<!ELEMENT PropertyDef (OriginalValue, NewValue) >
<!ATTLIST PropertyDef PropName CDATA #REQUIRED OriginRegularExpression (True|False) "False" NewRegularExpression (True|False) "False" AddedProperty (True|False) "False" >

<!ELEMENT OriginalValue ( #PCDATA )>

<!ELEMENT NewValue ( #PCDATA )>

<!ELEMENT Hierarchy  (ObjectName, Hierarchy*) >
<!ATTLIST Hierarchy MicClass CDATA #REQUIRED>

<!ELEMENT ObjectName  ( #PCDATA ) >

<!ELEMENT Step (Obj,Details,Time,TimeTick* ,(Step|HtmlStep|Doc)*, DataMapping?, NodeArgs) >
<!ATTLIST Step rID ID #REQUIRED retval CDATA #IMPLIED>

<!ELEMENT HtmlStep (HTML,TimeTick*,(Step|HtmlStep|Doc)*,NodeArgs) >
<!ATTLIST HtmlStep rID ID #REQUIRED >

<!ELEMENT Obj ( #PCDATA ) >
<!ATTLIST Obj plainTxt (False|True) "True">

<!ELEMENT Details ( #PCDATA ) >
<!ATTLIST Details plainTxt (False|True) "True">

<!ELEMENT Time ( #PCDATA ) >

<!ELEMENT HTML ( #PCDATA ) >

<!ELEMENT Disp ( #PCDATA ) >

<!ELEMENT TimeTick ( #PCDATA ) >

<!ELEMENT DataMapping ( DataMappedItem* )>
<!ELEMENT DataMappedItem EMPTY >
<!ATTLIST DataMappedItem dsName CDATA #REQUIRED >
<!ATTLIST DataMappedItem rowId CDATA #REQUIRED >

<!ELEMENT NodeArgs (Disp,TopPane?,BtmPane?,ExtendedInfo? )>
<!ATTLIST NodeArgs eType CDATA #REQUIRED icon CDATA #REQUIRED nRep CDATA #REQUIRED UserNote CDATA #IMPLIED filter (False|True) "True">
<!ATTLIST NodeArgs status (Passed|Failed|Done|Warning|Information) "Done">
<!ATTLIST NodeArgs iconSel CDATA #IMPLIED nType CDATA #IMPLIED MovieMarker CDATA "">
<!ATTLIST NodeArgs Source CDATA #IMPLIED SourceLine CDATA #IMPLIED StepFlowItemKey CDATA #IMPLIED >

<!ELEMENT TopPane (Path)>

<!ELEMENT BtmPane ( (Path|WR)?,ASHilite?)>
<!ATTLIST BtmPane vType CDATA "HTML">

<!ELEMENT Path ( #PCDATA ) >

<!ELEMENT ASHilite ( #PCDATA ) >

<!ELEMENT WR ( #PCDATA ) >

<!ELEMENT ExtendedInfo ( StepData ) >

<!ATTLIST ExtendedInfo StepType CDATA #REQUIRED>
<!ELEMENT DT (NodeArgs) >
<!ATTLIST DT rID ID #REQUIRED>

<!ELEMENT Summary (Param*)>
<!ATTLIST Summary sTime CDATA #IMPLIED eTime CDATA #IMPLIED passed CDATA #IMPLIED failed CDATA #IMPLIED warnings CDATA #IMPLIED retval CDATA #IMPLIED stopped (False|True) "False" >

<!ELEMENT Param (ParamName,ParamVal)+ >
<!ATTLIST Param paramInOut (In|Out) "In">

<!ELEMENT ParamName ( #PCDATA ) >

<!ELEMENT ParamVal ( #PCDATA ) >

]
>
<Report ver="2.0" tmZone="India Standard Time">
<General productName="HP Unified Functional Testing" productVer="12.52" os="Windows 7" host="XIN009OL20QWH"><DocLocation><![CDATA[C:\IDBPM_UFT\Test_Scripts\Disco_TerminateTask]]></DocLocation></General>
<Doc rID="T1"   productName= "HP Unified Functional Testing"  >
<DName><![CDATA[Disco_TerminateTask]]></DName>
<Res><![CDATA[Res3]]></Res>
<DT rID="T2">
<NodeArgs eType="Table" icon="2" nRep="4" filter="False" >
<Disp><![CDATA[Run-Time Data Table]]></Disp>
<BtmPane vType="Table" >
<Path><![CDATA[Default.xls]]></Path>
</BtmPane>
</NodeArgs>
</DT>
<DIter rID="T3" iterID="1" >
<Action rID="T4">
<AName><![CDATA[BeginTest]]></AName>
<Action rID="T5">
<AName><![CDATA[OpenChrome&URL]]></AName>
<Step rID="T6">
<Obj plainTxt="False" ><![CDATA[SystemUtil]]></Obj>
<Details plainTxt="False" ><![CDATA[SystemUtil]]></Details>
<Time><![CDATA[2/1/2018 - 16:58:56]]></Time>
<TimeTick>1517484536</TimeTick>
<Step rID="T7">
<Obj plainTxt="False" ><![CDATA[Run "Chrome",1]]></Obj>
<Details plainTxt="False" ><![CDATA[Run "Chrome",1]]></Details>
<Time><![CDATA[2/1/2018 - 16:58:56]]></Time>
<TimeTick>1517484536</TimeTick>
<NodeArgs eType="Replay" icon="5" nRep="12" status="Passed" MovieMarker="MARK896" Source="OpenChrome&amp;URL" SourceLine="-1" >
<Disp><![CDATA[Run "Chrome",1]]></Disp>
</NodeArgs>
</Step>
<NodeArgs eType="Replay" icon="5" nRep="11" status="Passed" MovieMarker="MARK895" Source="OpenChrome&amp;URL" SourceLine="-1" >
<Disp><![CDATA[SystemUtil]]></Disp>
</NodeArgs>
</Step>
<Step rID="T8">
<Obj plainTxt="False" ><![CDATA[BPM Console]]></Obj>
<Details plainTxt="False" ><![CDATA[Browser]]></Details>
<Time><![CDATA[2/1/2018 - 16:59:05]]></Time>
<TimeTick>1517484545</TimeTick>
<Step rID="T9">
<Obj plainTxt="False" ><![CDATA[InsightObject.Click]]></Obj>
<Details plainTxt="False" ><![CDATA[]]></Details>
<Time><![CDATA[2/1/2018 - 16:59:05]]></Time>
<TimeTick>1517484545</TimeTick>
<NodeArgs eType="Replay" icon="7" nRep="15" MovieMarker="MARK897" Source="OpenChrome&amp;URL" SourceLine="-1" >
<Disp><![CDATA[InsightObject.Click]]></Disp>
</NodeArgs>
</Step>
<NodeArgs eType="Context" icon="6" nRep="14" Source="OpenChrome&amp;URL" SourceLine="-1" >
<Disp><![CDATA[BPM Console]]></Disp>
</NodeArgs>
</Step>
<Summary sTime="2/1/2018 - 16:58:54" eTime="2/1/2018 - 16:59:06" passed="1" failed="0" warnings="0" ></Summary>
<NodeArgs eType="StartAction" icon="4" nRep="8" status="Passed" MovieMarker="MARK894" >
<Disp><![CDATA[OpenChrome&URL Summary]]></Disp>
</NodeArgs>
</Action>
<Action rID="T10">
<AName><![CDATA[LoginBPM]]></AName>
<Step rID="T11">
<Obj plainTxt="False" ><![CDATA[[ Username ].Set]]></Obj>
<Details plainTxt="False" ><![CDATA[""]]></Details>
<Time><![CDATA[2/1/2018 - 16:59:06]]></Time>
<TimeTick>1517484546</TimeTick>
<NodeArgs eType="Replay" icon="8" nRep="20" MovieMarker="MARK899" Source="LoginBPM" SourceLine="-1" >
<Disp><![CDATA[[ Username ].Set]]></Disp>
</NodeArgs>
</Step>
<Step rID="T12">
<Obj plainTxt="False" ><![CDATA[[ Username ].Set]]></Obj>
<Details plainTxt="False" ><![CDATA["pvutla"]]></Details>
<Time><![CDATA[2/1/2018 - 16:59:07]]></Time>
<TimeTick>1517484547</TimeTick>
<NodeArgs eType="Replay" icon="8" nRep="23" MovieMarker="MARK900" Source="LoginBPM" SourceLine="-1" >
<Disp><![CDATA[[ Username ].Set]]></Disp>
</NodeArgs>
</Step>
<Step rID="T13">
<Obj plainTxt="False" ><![CDATA[[ Password ].Set]]></Obj>
<Details plainTxt="False" ><![CDATA[""]]></Details>
<Time><![CDATA[2/1/2018 - 16:59:07]]></Time>
<TimeTick>1517484547</TimeTick>
<NodeArgs eType="Replay" icon="8" nRep="26" MovieMarker="MARK901" Source="LoginBPM" SourceLine="-1" >
<Disp><![CDATA[[ Password ].Set]]></Disp>
</NodeArgs>
</Step>
<Step rID="T14">
<Obj plainTxt="False" ><![CDATA[[ Password ].SetSecure]]></Obj>
<Details plainTxt="False" ><![CDATA["5a5b5cd3d3aeb1aaff2166463fc2fb473451835de656"]]></Details>
<Time><![CDATA[2/1/2018 - 16:59:08]]></Time>
<TimeTick>1517484548</TimeTick>
<NodeArgs eType="Replay" icon="8" nRep="29" MovieMarker="MARK902" Source="LoginBPM" SourceLine="-1" >
<Disp><![CDATA[[ Password ].SetSecure]]></Disp>
</NodeArgs>
</Step>
<Step rID="T15">
<Obj plainTxt="False" ><![CDATA[[ login_signin_button ].Click]]></Obj>
<Details plainTxt="False" ><![CDATA[]]></Details>
<Time><![CDATA[2/1/2018 - 16:59:08]]></Time>
<TimeTick>1517484548</TimeTick>
<NodeArgs eType="Replay" icon="9" nRep="32" MovieMarker="MARK903" Source="LoginBPM" SourceLine="-1" >
<Disp><![CDATA[[ login_signin_button ].Click]]></Disp>
</NodeArgs>
</Step>
<Step rID="T16">
<Obj plainTxt="False" ><![CDATA[[ WebElement ].Exist]]></Obj>
<Details plainTxt="False" ><![CDATA["Object exists"]]></Details>
<Time><![CDATA[2/1/2018 - 16:59:10]]></Time>
<TimeTick>1517484550</TimeTick>
<NodeArgs eType="Replay" icon="10" nRep="39" MovieMarker="MARK904" Source="LoginBPM" SourceLine="-1" >
<Disp><![CDATA[[ WebElement ].Exist]]></Disp>
</NodeArgs>
</Step>
<Step rID="T17">
<Obj plainTxt="False" ><![CDATA[[ Disco ].Exist]]></Obj>
<Details plainTxt="False" ><![CDATA["Object exists"]]></Details>
<Time><![CDATA[2/1/2018 - 16:59:31]]></Time>
<TimeTick>1517484571</TimeTick>
<NodeArgs eType="Replay" icon="10" nRep="41" MovieMarker="MARK905" Source="LoginBPM" SourceLine="-1" >
<Disp><![CDATA[[ Disco ].Exist]]></Disp>
</NodeArgs>
</Step>
<Step rID="T18">
<Obj plainTxt="False" ><![CDATA[[ Disco ]]]></Obj>
<Details plainTxt="False" ><![CDATA[WebElement]]></Details>
<Time><![CDATA[2/1/2018 - 16:59:31]]></Time>
<TimeTick>1517484571</TimeTick>
<Step rID="T19">
<Obj plainTxt="False" ><![CDATA["[ Disco ]"]]></Obj>
<Details plainTxt="False" ><![CDATA[Property &quot;innertext&quot; has the expected value: &quot;Disco&quot;.]]></Details>
<Time><![CDATA[2/1/2018 - 16:59:31]]></Time>
<TimeTick>1517484571</TimeTick>
<NodeArgs eType="Replay" icon="10" nRep="44" status="Passed" nType="CheckProperty" MovieMarker="MARK906" Source="LoginBPM" SourceLine="-1" >
<Disp><![CDATA["[ Disco ]"]]></Disp>
</NodeArgs>
</Step>
<NodeArgs eType="Context" icon="10" nRep="43" status="Passed" Source="LoginBPM" SourceLine="-1" >
<Disp><![CDATA[[ Disco ]]]></Disp>
</NodeArgs>
</Step>
<Step rID="T20">
<Obj ><![CDATA[Login to BPM: Successful]]></Obj>
<Details ><![CDATA[Logged in to BPM Console]]></Details>
<Time><![CDATA[2/1/2018 - 16:59:56]]></Time>
<TimeTick>1517484596</TimeTick>
<NodeArgs eType="User" icon="11" nRep="45" status="Passed" Source="LoginBPM" SourceLine="-1" >
<Disp><![CDATA[Login to BPM: Successful]]></Disp>
</NodeArgs>
</Step>
<Summary sTime="2/1/2018 - 16:59:06" eTime="2/1/2018 - 16:59:56" passed="2" failed="0" warnings="0" ></Summary>
<NodeArgs eType="StartAction" icon="4" nRep="17" status="Passed" MovieMarker="MARK898" >
<Disp><![CDATA[LoginBPM Summary]]></Disp>
</NodeArgs>
</Action>
<Action rID="T21">
<AName><![CDATA[CreateDisconnectTask]]></AName>
<Step rID="T22">
<Obj plainTxt="False" ><![CDATA[[ createNewDisconnectRequestButton ].Click]]></Obj>
<Details plainTxt="False" ><![CDATA[]]></Details>
<Time><![CDATA[2/1/2018 - 16:59:57]]></Time>
<TimeTick>1517484597</TimeTick>
<NodeArgs eType="Replay" icon="9" nRep="50" MovieMarker="MARK908" Source="CreateDisconnectTask" SourceLine="-1" >
<Disp><![CDATA[[ createNewDisconnectRequestButton ].Click]]></Disp>
</NodeArgs>
</Step>
<Step rID="T23">
<Obj plainTxt="False" ><![CDATA[[ WebElement ].Exist]]></Obj>
<Details plainTxt="False" ><![CDATA["Object does not exist"]]></Details>
<Time><![CDATA[2/1/2018 - 17:00:07]]></Time>
<TimeTick>1517484607</TimeTick>
<NodeArgs eType="Replay" icon="10" nRep="83" MovieMarker="MARK909" Source="CreateDisconnectTask" SourceLine="-1" >
<Disp><![CDATA[[ WebElement ].Exist]]></Disp>
</NodeArgs>
</Step>
<Step rID="T24">
<Obj plainTxt="False" ><![CDATA[[ New Disconnect Request ].WaitProperty]]></Obj>
<Details plainTxt="False" ><![CDATA["innertext", "New Disconnect Request", "New Disconnect Request", 1000]]></Details>
<Time><![CDATA[2/1/2018 - 17:00:08]]></Time>
<TimeTick>1517484608</TimeTick>
<NodeArgs eType="Replay" icon="10" nRep="86" MovieMarker="MARK910" Source="CreateDisconnectTask" SourceLine="-1" >
<Disp><![CDATA[[ New Disconnect Request ].WaitProperty]]></Disp>
</NodeArgs>
</Step>
<Step rID="T25">
<Obj plainTxt="False" ><![CDATA[[ New Disconnect Request ]]]></Obj>
<Details plainTxt="False" ><![CDATA[WebElement]]></Details>
<Time><![CDATA[2/1/2018 - 17:00:08]]></Time>
<TimeTick>1517484608</TimeTick>
<Step rID="T26">
<Obj plainTxt="False" ><![CDATA["[ New Disconnect Request ]"]]></Obj>
<Details plainTxt="False" ><![CDATA[Property &quot;innertext&quot; has the expected value: &quot;New Disconnect Request&quot;.]]></Details>
<Time><![CDATA[2/1/2018 - 17:00:08]]></Time>
<TimeTick>1517484608</TimeTick>
<NodeArgs eType="Replay" icon="10" nRep="89" status="Passed" nType="CheckProperty" MovieMarker="MARK911" Source="CreateDisconnectTask" SourceLine="-1" >
<Disp><![CDATA["[ New Disconnect Request ]"]]></Disp>
</NodeArgs>
</Step>
<NodeArgs eType="Context" icon="10" nRep="88" status="Passed" Source="CreateDisconnectTask" SourceLine="-1" >
<Disp><![CDATA[[ New Disconnect Request ]]]></Disp>
</NodeArgs>
</Step>
<Step rID="T27">
<Obj plainTxt="False" ><![CDATA[[ Customer Id* ].Set]]></Obj>
<Details plainTxt="False" ><![CDATA["603107"]]></Details>
<Time><![CDATA[2/1/2018 - 17:00:08]]></Time>
<TimeTick>1517484608</TimeTick>
<NodeArgs eType="Replay" icon="8" nRep="92" MovieMarker="MARK912" Source="CreateDisconnectTask" SourceLine="-1" >
<Disp><![CDATA[[ Customer Id* ].Set]]></Disp>
</NodeArgs>
</Step>
<Step rID="T28">
<Obj plainTxt="False" ><![CDATA[[ Customer Name* ].Set]]></Obj>
<Details plainTxt="False" ><![CDATA["AutoM Integration Testing"]]></Details>
<Time><![CDATA[2/1/2018 - 17:00:08]]></Time>
<TimeTick>1517484608</TimeTick>
<NodeArgs eType="Replay" icon="8" nRep="95" MovieMarker="MARK913" Source="CreateDisconnectTask" SourceLine="-1" >
<Disp><![CDATA[[ Customer Name* ].Set]]></Disp>
</NodeArgs>
</Step>
<Step rID="T29">
<Obj plainTxt="False" ><![CDATA[[ customer Number* ].Set]]></Obj>
<Details plainTxt="False" ><![CDATA["603107"]]></Details>
<Time><![CDATA[2/1/2018 - 17:00:08]]></Time>
<TimeTick>1517484608</TimeTick>
<NodeArgs eType="Replay" icon="8" nRep="98" MovieMarker="MARK914" Source="CreateDisconnectTask" SourceLine="-1" >
<Disp><![CDATA[[ customer Number* ].Set]]></Disp>
</NodeArgs>
</Step>
<Step rID="T30">
<Obj plainTxt="False" ><![CDATA[[ Disconnect Date* ].Set]]></Obj>
<Details plainTxt="False" ><![CDATA["2/1/2018"]]></Details>
<Time><![CDATA[2/1/2018 - 17:00:08]]></Time>
<TimeTick>1517484608</TimeTick>
<NodeArgs eType="Replay" icon="8" nRep="101" MovieMarker="MARK915" Source="CreateDisconnectTask" SourceLine="-1" >
<Disp><![CDATA[[ Disconnect Date* ].Set]]></Disp>
</NodeArgs>
</Step>
<Step rID="T31">
<Obj plainTxt="False" ><![CDATA[[ Disconnect Reason* ].Set]]></Obj>
<Details plainTxt="False" ><![CDATA["AutoM Testing"]]></Details>
<Time><![CDATA[2/1/2018 - 17:00:09]]></Time>
<TimeTick>1517484609</TimeTick>
<NodeArgs eType="Replay" icon="8" nRep="104" MovieMarker="MARK916" Source="CreateDisconnectTask" SourceLine="-1" >
<Disp><![CDATA[[ Disconnect Reason* ].Set]]></Disp>
</NodeArgs>
</Step>
<Step rID="T32">
<Obj plainTxt="False" ><![CDATA[[ Disconnect Type* ].Set]]></Obj>
<Details plainTxt="False" ><![CDATA["Internal Billing"]]></Details>
<Time><![CDATA[2/1/2018 - 17:00:09]]></Time>
<TimeTick>1517484609</TimeTick>
<NodeArgs eType="Replay" icon="8" nRep="107" MovieMarker="MARK917" Source="CreateDisconnectTask" SourceLine="-1" >
<Disp><![CDATA[[ Disconnect Type* ].Set]]></Disp>
</NodeArgs>
</Step>
<Step rID="T33">
<Obj plainTxt="False" ><![CDATA[[ Main Contact Email* ].Set]]></Obj>
<Details plainTxt="False" ><![CDATA["pvutla@centurylink.com"]]></Details>
<Time><![CDATA[2/1/2018 - 17:00:09]]></Time>
<TimeTick>1517484609</TimeTick>
<NodeArgs eType="Replay" icon="8" nRep="110" MovieMarker="MARK918" Source="CreateDisconnectTask" SourceLine="-1" >
<Disp><![CDATA[[ Main Contact Email* ].Set]]></Disp>
</NodeArgs>
</Step>
<Step rID="T34">
<Obj plainTxt="False" ><![CDATA[[ Main Contact Name* ].Set]]></Obj>
<Details plainTxt="False" ><![CDATA["PVUTLA"]]></Details>
<Time><![CDATA[2/1/2018 - 17:00:09]]></Time>
<TimeTick>1517484609</TimeTick>
<NodeArgs eType="Replay" icon="8" nRep="113" MovieMarker="MARK919" Source="CreateDisconnectTask" SourceLine="-1" >
<Disp><![CDATA[[ Main Contact Name* ].Set]]></Disp>
</NodeArgs>
</Step>
<Step rID="T35">
<Obj plainTxt="False" ><![CDATA[[ Submitted By* ].Set]]></Obj>
<Details plainTxt="False" ><![CDATA["Prasanth.Vutla"]]></Details>
<Time><![CDATA[2/1/2018 - 17:00:09]]></Time>
<TimeTick>1517484609</TimeTick>
<NodeArgs eType="Replay" icon="8" nRep="116" MovieMarker="MARK920" Source="CreateDisconnectTask" SourceLine="-1" >
<Disp><![CDATA[[ Submitted By* ].Set]]></Disp>
</NodeArgs>
</Step>
<Step rID="T36">
<Obj plainTxt="False" ><![CDATA[[ Technical Contact Email ].Set]]></Obj>
<Details plainTxt="False" ><![CDATA["prasanth.vutla@centurylink.com"]]></Details>
<Time><![CDATA[2/1/2018 - 17:00:10]]></Time>
<TimeTick>1517484610</TimeTick>
<NodeArgs eType="Replay" icon="8" nRep="119" MovieMarker="MARK921" Source="CreateDisconnectTask" SourceLine="-1" >
<Disp><![CDATA[[ Technical Contact Email ].Set]]></Disp>
</NodeArgs>
</Step>
<Step rID="T37">
<Obj plainTxt="False" ><![CDATA[[ Technical Contact Name ].Set]]></Obj>
<Details plainTxt="False" ><![CDATA["QA Automation"]]></Details>
<Time><![CDATA[2/1/2018 - 17:00:10]]></Time>
<TimeTick>1517484610</TimeTick>
<NodeArgs eType="Replay" icon="8" nRep="122" MovieMarker="MARK922" Source="CreateDisconnectTask" SourceLine="-1" >
<Disp><![CDATA[[ Technical Contact Name ].Set]]></Disp>
</NodeArgs>
</Step>
<Step rID="T38">
<Obj plainTxt="False" ><![CDATA[[ WorkRequest Number* ].Set]]></Obj>
<Details plainTxt="False" ><![CDATA["687081"]]></Details>
<Time><![CDATA[2/1/2018 - 17:00:10]]></Time>
<TimeTick>1517484610</TimeTick>
<NodeArgs eType="Replay" icon="8" nRep="125" MovieMarker="MARK923" Source="CreateDisconnectTask" SourceLine="-1" >
<Disp><![CDATA[[ WorkRequest Number* ].Set]]></Disp>
</NodeArgs>
</Step>
<Step rID="T39">
<Obj plainTxt="False" ><![CDATA[[ Start ].WaitProperty]]></Obj>
<Details plainTxt="False" ><![CDATA["visible", True, True, 1000]]></Details>
<Time><![CDATA[2/1/2018 - 17:00:19]]></Time>
<TimeTick>1517484619</TimeTick>
<NodeArgs eType="Replay" icon="10" nRep="137" MovieMarker="MARK924" Source="CreateDisconnectTask" SourceLine="-1" >
<Disp><![CDATA[[ Start ].WaitProperty]]></Disp>
</NodeArgs>
</Step>
<Step rID="T40">
<Obj plainTxt="False" ><![CDATA[[ Start ]]]></Obj>
<Details plainTxt="False" ><![CDATA[WebElement]]></Details>
<Time><![CDATA[2/1/2018 - 17:00:20]]></Time>
<TimeTick>1517484620</TimeTick>
<Step rID="T41">
<Obj plainTxt="False" ><![CDATA["[ Start ]"]]></Obj>
<Details plainTxt="False" ><![CDATA[Property &quot;innertext&quot; has the expected value: &quot;Start&quot;.]]></Details>
<Time><![CDATA[2/1/2018 - 17:00:20]]></Time>
<TimeTick>1517484620</TimeTick>
<NodeArgs eType="Replay" icon="10" nRep="140" status="Passed" nType="CheckProperty" MovieMarker="MARK925" Source="CreateDisconnectTask" SourceLine="-1" >
<Disp><![CDATA["[ Start ]"]]></Disp>
</NodeArgs>
</Step>
<NodeArgs eType="Context" icon="10" nRep="139" status="Passed" Source="CreateDisconnectTask" SourceLine="-1" >
<Disp><![CDATA[[ Start ]]]></Disp>
</NodeArgs>
</Step>
<Step rID="T42">
<Obj plainTxt="False" ><![CDATA[[ Start ].Click]]></Obj>
<Details plainTxt="False" ><![CDATA[]]></Details>
<Time><![CDATA[2/1/2018 - 17:00:35]]></Time>
<TimeTick>1517484635</TimeTick>
<NodeArgs eType="Replay" icon="10" nRep="143" MovieMarker="MARK926" Source="CreateDisconnectTask" SourceLine="-1" >
<Disp><![CDATA[[ Start ].Click]]></Disp>
</NodeArgs>
</Step>
<Step rID="T43">
<Obj plainTxt="False" ><![CDATA[[ WebElement ].Exist]]></Obj>
<Details plainTxt="False" ><![CDATA["Object exists"]]></Details>
<Time><![CDATA[2/1/2018 - 17:00:37]]></Time>
<TimeTick>1517484637</TimeTick>
<NodeArgs eType="Replay" icon="10" nRep="148" MovieMarker="MARK927" Source="CreateDisconnectTask" SourceLine="-1" >
<Disp><![CDATA[[ WebElement ].Exist]]></Disp>
</NodeArgs>
</Step>
<Step rID="T44">
<Obj ><![CDATA[Disconnect Task Created - Successfully for Terminate]]></Obj>
<Details ><![CDATA[Create Task Successful]]></Details>
<Time><![CDATA[2/1/2018 - 17:00:47]]></Time>
<TimeTick>1517484647</TimeTick>
<NodeArgs eType="User" icon="11" nRep="149" status="Passed" Source="CreateDisconnectTask" SourceLine="-1" >
<Disp><![CDATA[Disconnect Task Created - Successfully for Terminate]]></Disp>
</NodeArgs>
</Step>
<Summary sTime="2/1/2018 - 16:59:57" eTime="2/1/2018 - 17:00:47" passed="3" failed="0" warnings="0" ></Summary>
<NodeArgs eType="StartAction" icon="4" nRep="47" status="Passed" MovieMarker="MARK907" >
<Disp><![CDATA[CreateDisconnectTask Summary]]></Disp>
</NodeArgs>
</Action>
<Action rID="T45">
<AName><![CDATA[FilterDisco_WR]]></AName>
<Step rID="T46">
<Obj plainTxt="False" ><![CDATA[[ Disco ].Click]]></Obj>
<Details plainTxt="False" ><![CDATA[]]></Details>
<Time><![CDATA[2/1/2018 - 17:00:48]]></Time>
<TimeTick>1517484648</TimeTick>
<NodeArgs eType="Replay" icon="10" nRep="154" MovieMarker="MARK929" Source="FilterDisco_WR" SourceLine="-1" >
<Disp><![CDATA[[ Disco ].Click]]></Disp>
</NodeArgs>
</Step>
<Step rID="T47">
<Obj plainTxt="False" ><![CDATA[[ WebElement ].Exist]]></Obj>
<Details plainTxt="False" ><![CDATA["Object does not exist"]]></Details>
<Time><![CDATA[2/1/2018 - 17:00:58]]></Time>
<TimeTick>1517484658</TimeTick>
<NodeArgs eType="Replay" icon="10" nRep="178" MovieMarker="MARK930" Source="FilterDisco_WR" SourceLine="-1" >
<Disp><![CDATA[[ WebElement ].Exist]]></Disp>
</NodeArgs>
</Step>
<Step rID="T48">
<Obj plainTxt="False" ><![CDATA[[ Disco ].Fire Web Event]]></Obj>
<Details plainTxt="False" ><![CDATA["onmouseup"]]></Details>
<Time><![CDATA[2/1/2018 - 17:00:59]]></Time>
<TimeTick>1517484659</TimeTick>
<NodeArgs eType="Replay" icon="10" nRep="181" MovieMarker="MARK931" Source="FilterDisco_WR" SourceLine="-1" >
<Disp><![CDATA[[ Disco ].Fire Web Event]]></Disp>
</NodeArgs>
</Step>
<Step rID="T49">
<Obj plainTxt="False" ><![CDATA[[ Disco ].Fire Web Event]]></Obj>
<Details plainTxt="False" ><![CDATA["onmouseover"]]></Details>
<Time><![CDATA[2/1/2018 - 17:01:00]]></Time>
<TimeTick>1517484660</TimeTick>
<NodeArgs eType="Replay" icon="10" nRep="184" MovieMarker="MARK932" Source="FilterDisco_WR" SourceLine="-1" >
<Disp><![CDATA[[ Disco ].Fire Web Event]]></Disp>
</NodeArgs>
</Step>
<Step rID="T50">
<Obj plainTxt="False" ><![CDATA[[ Disco ].WaitProperty]]></Obj>
<Details plainTxt="False" ><![CDATA["innertext", "Disco", "Disco", 1000]]></Details>
<Time><![CDATA[2/1/2018 - 17:01:10]]></Time>
<TimeTick>1517484670</TimeTick>
<NodeArgs eType="Replay" icon="10" nRep="187" MovieMarker="MARK933" Source="FilterDisco_WR" SourceLine="-1" >
<Disp><![CDATA[[ Disco ].WaitProperty]]></Disp>
</NodeArgs>
</Step>
<Step rID="T51">
<Obj plainTxt="False" ><![CDATA[[ Disco ]]]></Obj>
<Details plainTxt="False" ><![CDATA[WebElement]]></Details>
<Time><![CDATA[2/1/2018 - 17:01:10]]></Time>
<TimeTick>1517484670</TimeTick>
<Step rID="T52">
<Obj plainTxt="False" ><![CDATA["[ Disco ]"]]></Obj>
<Details plainTxt="False" ><![CDATA[Property &quot;innertext&quot; has the expected value: &quot;Disco&quot;.]]></Details>
<Time><![CDATA[2/1/2018 - 17:01:10]]></Time>
<TimeTick>1517484670</TimeTick>
<NodeArgs eType="Replay" icon="10" nRep="190" status="Passed" nType="CheckProperty" MovieMarker="MARK934" Source="FilterDisco_WR" SourceLine="-1" >
<Disp><![CDATA["[ Disco ]"]]></Disp>
</NodeArgs>
</Step>
<NodeArgs eType="Context" icon="10" nRep="189" status="Passed" Source="FilterDisco_WR" SourceLine="-1" >
<Disp><![CDATA[[ Disco ]]]></Disp>
</NodeArgs>
</Step>
<Step rID="T53">
<Obj plainTxt="False" ><![CDATA[[ filterButton ].Fire Web Event]]></Obj>
<Details plainTxt="False" ><![CDATA["onmouseover"]]></Details>
<Time><![CDATA[2/1/2018 - 17:01:12]]></Time>
<TimeTick>1517484672</TimeTick>
<NodeArgs eType="Replay" icon="9" nRep="194" MovieMarker="MARK935" Source="FilterDisco_WR" SourceLine="-1" >
<Disp><![CDATA[[ filterButton ].Fire Web Event]]></Disp>
</NodeArgs>
</Step>
<Step rID="T54">
<Obj plainTxt="False" ><![CDATA[[ filterButton ].Click]]></Obj>
<Details plainTxt="False" ><![CDATA[]]></Details>
<Time><![CDATA[2/1/2018 - 17:01:24]]></Time>
<TimeTick>1517484684</TimeTick>
<NodeArgs eType="Replay" icon="9" nRep="198" MovieMarker="MARK936" Source="FilterDisco_WR" SourceLine="-1" >
<Disp><![CDATA[[ filterButton ].Click]]></Disp>
</NodeArgs>
</Step>
<Step rID="T55">
<Obj plainTxt="False" ><![CDATA[[ Disco ].Fire Web Event]]></Obj>
<Details plainTxt="False" ><![CDATA["onmouseover"]]></Details>
<Time><![CDATA[2/1/2018 - 17:01:30]]></Time>
<TimeTick>1517484690</TimeTick>
<NodeArgs eType="Replay" icon="10" nRep="201" MovieMarker="MARK937" Source="FilterDisco_WR" SourceLine="-1" >
<Disp><![CDATA[[ Disco ].Fire Web Event]]></Disp>
</NodeArgs>
</Step>
<Step rID="T56">
<Obj plainTxt="False" ><![CDATA[[ filter-field-select ].Click]]></Obj>
<Details plainTxt="False" ><![CDATA[]]></Details>
<Time><![CDATA[2/1/2018 - 17:01:31]]></Time>
<TimeTick>1517484691</TimeTick>
<NodeArgs eType="Replay" icon="10" nRep="204" MovieMarker="MARK938" Source="FilterDisco_WR" SourceLine="-1" >
<Disp><![CDATA[[ filter-field-select ].Click]]></Disp>
</NodeArgs>
</Step>
<Step rID="T57">
<Obj plainTxt="False" ><![CDATA[[ WebButton ].Click]]></Obj>
<Details plainTxt="False" ><![CDATA[]]></Details>
<Time><![CDATA[2/1/2018 - 17:01:31]]></Time>
<TimeTick>1517484691</TimeTick>
<NodeArgs eType="Replay" icon="9" nRep="207" MovieMarker="MARK939" Source="FilterDisco_WR" SourceLine="-1" >
<Disp><![CDATA[[ WebButton ].Click]]></Disp>
</NodeArgs>
</Step>
<Step rID="T58">
<Obj plainTxt="False" ><![CDATA[[ Next ].Click]]></Obj>
<Details plainTxt="False" ><![CDATA[]]></Details>
<Time><![CDATA[2/1/2018 - 17:01:33]]></Time>
<TimeTick>1517484693</TimeTick>
<NodeArgs eType="Replay" icon="10" nRep="210" MovieMarker="MARK940" Source="FilterDisco_WR" SourceLine="-1" >
<Disp><![CDATA[[ Next ].Click]]></Disp>
</NodeArgs>
</Step>
<Step rID="T59">
<Obj plainTxt="False" ><![CDATA[[ Submitted By ].Fire Web Event]]></Obj>
<Details plainTxt="False" ><![CDATA["onmouseover"]]></Details>
<Time><![CDATA[2/1/2018 - 17:01:41]]></Time>
<TimeTick>1517484701</TimeTick>
<NodeArgs eType="Replay" icon="12" nRep="214" MovieMarker="MARK941" Source="FilterDisco_WR" SourceLine="-1" >
<Disp><![CDATA[[ Submitted By ].Fire Web Event]]></Disp>
</NodeArgs>
</Step>
<Step rID="T60">
<Obj plainTxt="False" ><![CDATA[[ WorkRequest Number ].Click]]></Obj>
<Details plainTxt="False" ><![CDATA[]]></Details>
<Time><![CDATA[2/1/2018 - 17:01:41]]></Time>
<TimeTick>1517484701</TimeTick>
<NodeArgs eType="Replay" icon="10" nRep="217" MovieMarker="MARK942" Source="FilterDisco_WR" SourceLine="-1" >
<Disp><![CDATA[[ WorkRequest Number ].Click]]></Disp>
</NodeArgs>
</Step>
<Step rID="T61">
<Obj plainTxt="False" ><![CDATA[[ filter-operator-select ].Click]]></Obj>
<Details plainTxt="False" ><![CDATA[]]></Details>
<Time><![CDATA[2/1/2018 - 17:01:47]]></Time>
<TimeTick>1517484707</TimeTick>
<NodeArgs eType="Replay" icon="10" nRep="220" MovieMarker="MARK943" Source="FilterDisco_WR" SourceLine="-1" >
<Disp><![CDATA[[ filter-operator-select ].Click]]></Disp>
</NodeArgs>
</Step>
<Step rID="T62">
<Obj plainTxt="False" ><![CDATA[[ WebButton ].Click]]></Obj>
<Details plainTxt="False" ><![CDATA[]]></Details>
<Time><![CDATA[2/1/2018 - 17:01:47]]></Time>
<TimeTick>1517484707</TimeTick>
<NodeArgs eType="Replay" icon="9" nRep="223" MovieMarker="MARK944" Source="FilterDisco_WR" SourceLine="-1" >
<Disp><![CDATA[[ WebButton ].Click]]></Disp>
</NodeArgs>
</Step>
<Step rID="T63">
<Obj plainTxt="False" ><![CDATA[[ Prev equalsnot equalis greater thanis less thanis not emptyis emptyNext1-6/6 ].Fire Web Event]]></Obj>
<Details plainTxt="False" ><![CDATA["onmouseover"]]></Details>
<Time><![CDATA[2/1/2018 - 17:01:54]]></Time>
<TimeTick>1517484714</TimeTick>
<NodeArgs eType="Replay" icon="10" nRep="227" MovieMarker="MARK945" Source="FilterDisco_WR" SourceLine="-1" >
<Disp><![CDATA[[ Prev equalsnot equalis greater thanis less thanis not emptyis emptyNext1-6/6 ].Fire Web Event]]></Disp>
</NodeArgs>
</Step>
<Step rID="T64">
<Obj plainTxt="False" ><![CDATA[[ equals ].Click]]></Obj>
<Details plainTxt="False" ><![CDATA[]]></Details>
<Time><![CDATA[2/1/2018 - 17:01:55]]></Time>
<TimeTick>1517484715</TimeTick>
<NodeArgs eType="Replay" icon="10" nRep="230" MovieMarker="MARK946" Source="FilterDisco_WR" SourceLine="-1" >
<Disp><![CDATA[[ equals ].Click]]></Disp>
</NodeArgs>
</Step>
<Step rID="T65">
<Obj plainTxt="False" ><![CDATA[[ WebEdit ].Set]]></Obj>
<Details plainTxt="False" ><![CDATA["687081"]]></Details>
<Time><![CDATA[2/1/2018 - 17:02:00]]></Time>
<TimeTick>1517484720</TimeTick>
<NodeArgs eType="Replay" icon="8" nRep="233" MovieMarker="MARK947" Source="FilterDisco_WR" SourceLine="-1" >
<Disp><![CDATA[[ WebEdit ].Set]]></Disp>
</NodeArgs>
</Step>
<Step rID="T66">
<Obj plainTxt="False" ><![CDATA[[ Add ].Click]]></Obj>
<Details plainTxt="False" ><![CDATA[]]></Details>
<Time><![CDATA[2/1/2018 - 17:02:01]]></Time>